ID,Block,Chapter / Subtopic,Question Type,Question Text,Data / Paragraph,Option A,Option B,Option C,Option D,Option E,Correct Answer,Difficulty Level
Q509,VARC,PARAGRAPH COMPLETION,Paragraph Completion,Choose the option that completes the paragraph in the most appropriate way.,"Relations between the factory and the dealer are distant and usually strained as the factory tries to force cars on the dealers to smooth out production. Relations between the dealer and the customer are equally strained because dealers continuously adjust prices make Ideals to adjust demand with supply while maximizing profits. This becomes a system marked by a lack of long-term commitment on either side, which maximize feelings of mistrust. In order to maximize their bargaining positions, everyone holds back information the dealer about the product and the consumer about his true desires.","As a result, 'deal making' becomes rampant, without concern for customer satisfaction.","As a result, inefficiencies creep into the supply chain.","As a result, everyone treats the other as an adversary, rather than as an ally.","As a result, fundamental innovations are becoming scarce in the automobile industry.","As a result, everyone loses in the long run.",E,Moderate
Q510,VARC,PARAGRAPH COMPLETION,Paragraph Completion,Choose the option that completes the paragraph in the most appropriate way.,"In the evolving world order, the comparative advantage of the United States lies in its military force. Diplomacy and international law have always been regarded as annoying encumbrances, unless they can be used to advantage against an enemy. Every active player in world affairs professes to seek only peace and to prefer negotiation to violence and coercion.","However, diplomacy has often been used as a mask by nations which intended to use force.","However, when the veil is lifted, we commonly see that diplomacy is understood as a disguise for the rule of force.","However, history has shown that many of these nations do not practice what they profess.","However, history tells us that peace is professed to vote by those who intend to use violence.","However, when unmasked, such nations reveal a penchant for the use of force.",B,Moderate
Q511,VARC,PARAGRAPH COMPLETION,Paragraph Completion,Choose the option that completes the paragraph in the most appropriate way.,"Age has a curvilinear relationship with the exploitation of opportunity. Initially, age will increase the likelihood that a person will exploit an entrepreneurial opportunity because people gather much of the knowledge necessary to exploit opportunities over the course of their lives, and because age provides credibility in transmitting that information to others. However, as people become older, their willingness to bear risks declines, their opportunity costs rise, and they become less receptive to new information.","As a result, people transmit more information rather than experiment with new ideas as they reach an advanced age.","As a result, people are reluctant to experiment with new ideas as they reach an advanced age.","As a result, only people with lower opportunity costs exploit opportunity when they reach an advanced age.","As a result, people become reluctant to exploit east entrepreneurial opportunities when they reach an advanced age.","As a result, people depend on credibility rather than on novelty as they reach an advanced age.",D,Moderate
Q512,VARC,PARAGRAPH COMPLETION,Paragraph Completion,Choose the option that completes the paragraph in the most appropriate way.,"We can usefully think of theoretical models as maps, which help us navigate unfamiliar territory. The most accurate map that it is possible to construct would be of no practical pause whatsoever, for it would be an exact replica, on exactly the same scale, of the place where we were. Good maps pull out the most important features and throw away a huge amount of much less valuable information. Of course, maps can be bad as well as good - witness the attempts by medieval Europe to produce a map of the world.","In the same way, a bad theory, no matter how impressive it may seem in principle, does little or nothing to help us understand a problem.","But good theories, just like good maps, are invaluable, even if they are simplified.","But good theories, just like good maps, will never represent unfamiliar concepts in detail.","But good theories, just like good maps, need to balance detail and feasibility of representation.","But good theories, just like good maps, are accurate only at a certain level of abstraction.",A,Moderate
Q513,VARC,PARAGRAPH COMPLETION,Sentence Arrangement,"Arrange sentences A, B, C and D between sentences 1 and 6 to form a logical sequence.","1. Buddhism is a way to salvation.\nA. But Buddhism is more severely analytical.\nB. In the Christian tradition there is also a concern for the fate of human society conceived as a whole, rather than merely as a sum or network of individuals.\nC. Salvation is a property, or achievement of individuals.\nD. Not only does it dissolve society into individuals, the individual in turn is dissolved into component parts and instants, a stream of events.\n6. In modern terminology, Buddhist doctrine is reductionist.",ABDC,CBAD,BDAC,ABCD,,B,Difficult
Q514,VARC,PARAGRAPH COMPLETION,Sentence Arrangement,"Arrange sentences A, B, C and D between sentences 1 and 6 to form a logical sequence.","1. The problem of improving Indian agriculture is both a sociological and an administrative one.\nA. It also appears that there is a direct relationship between the size of a state and development.\nB. The issues of Indian development, and the big old problem of India's agricultural sector, will remain with us long into the next century.\nC. Without improving Indian agriculture, no liberalisation and delicensing will be able to help India.\nD. At the end of the day, there has to be a ferment and movement of life and action in the vast segment of rural India.\n6. When it starts marching, India will fly.",DABC,CDBA,ACDB,ABCD,,D,Difficult
Q515,VARC,PARAGRAPH COMPLETION,Sentence Arrangement,"Arrange sentences A, B, C and D between sentences 1 and 6 to form a logical sequence.","1. Good literary magazines have always been good because of their editors.\nA. Furthermore, to edit by committee, as it were, would prevent any magazine from finding its own identity.\nB. The more quirky and idiosyncratic they have been, the better the magazine is, at least as a general rule.\nC. But the number of editors one can have for a magazine should also be determined by the number of contributions to it.\nD. To have four editors for an issue that contains only seven contributions, it is a bit silly to start with.\n6. However, in spite of this anomaly, the magazine does acquire merit in its attempt to give a comprehensive view of the Indian literary scene as it is today.",ABCD,BCDA,ABDC,CBAD,,B,Difficult
Q516,VARC,PARAGRAPH COMPLETION,Sentence Arrangement,"Arrange sentences A, B, C and D between sentences 1 and 6 to form a logical sequence.","1. It is the success story of the Indian expatriate in the US which today hogs much of the media coverage in India.\nA. East and West, the twain have met quite comfortably in their person, thank you.\nB. Especially in its more recent romancing-the-NRI phase.\nC. Seldom does the price of getting there more like not getting there or what's going on behind those sunny smiles get so much media hype.\nD. Well groomed, with their perfect Colgate smiles, and hair in place, they appear the picture of confidence which comes from having arrived.\n6. The festival of feature films and documentaries made by Americans of Indian descent being screened this fortnight, goes a long way in filling those gaps.",ACBD,DABC,BDAC,ABCD,,C,Difficult
Q517,VARC,READING COMPREHENSION,Passage-Based MCQ,Jehangir was called an emperor because,Many years ago there lived in India a great king called Jehangir. He ruled over a very big kingdom or empire. So he was called an emperor. The emperor wanted to be just to all his subjects. He ordered his soldiers to tie a big bell in front of the palace. Then he sent the soldiers to every part of the empire. They announced that if the people had any complaint they could come to the palace and ring the bell. The emperor himself would listen to their complaints. He would give them justice.,he was a great king,he ruled over a very big kingdom,he lived in India,he lived in a big empire many years ago,,B,Very Easy
Q518,VARC,READING COMPREHENSION,Passage-Based MCQ,What was the desire of Jehangir?,Many years ago there lived in India a great king called Jehangir. He ruled over a very big kingdom or empire. So he was called an emperor. The emperor wanted to be just to all his subjects. He ordered his soldiers to tie a big bell in front of the palace. Then he sent the soldiers to every part of the empire. They announced that if the people had any complaint they could come to the palace and ring the bell. The emperor himself would listen to their complaints. He would give them justice.,To order his soldiers.,To make many conquests.,To be just to his subjects.,To rule over a very big kingdom.,,C,Very Easy
Q519,VARC,READING COMPREHENSION,Passage-Based MCQ,The soldiers...,Many years ago there lived in India a great king called Jehangir. He ruled over a very big kingdom or empire. So he was called an emperor. The emperor wanted to be just to all his subjects. He ordered his soldiers to tie a big bell in front of the palace. Then he sent the soldiers to every part of the empire. They announced that if the people had any complaint they could come to the palace and ring the bell. The emperor himself would listen to their complaints. He would give them justice.,called all the people.,arrested all the criminals.,rode away to a distant land.,tied a big bell in front of the palace.,,D,Very Easy
Q520,VARC,READING COMPREHENSION,Passage-Based MCQ,Complaint means,Many years ago there lived in India a great king called Jehangir. He ruled over a very big kingdom or empire. So he was called an emperor. The emperor wanted to be just to all his subjects. He ordered his soldiers to tie a big bell in front of the palace. Then he sent the soldiers to every part of the empire. They announced that if the people had any complaint they could come to the palace and ring the bell. The emperor himself would listen to their complaints. He would give them justice.,complete,complexity,objections,disaster,,C,Very Easy
Q521,VARC,READING COMPREHENSION,Passage-Based MCQ,The people would ring the bell if,Many years ago there lived in India a great king called Jehangir. He ruled over a very big kingdom or empire. So he was called an emperor. The emperor wanted to be just to all his subjects. He ordered his soldiers to tie a big bell in front of the palace. Then he sent the soldiers to every part of the empire. They announced that if the people had any complaint they could come to the palace and ring the bell. The emperor himself would listen to their complaints. He would give them justice.,they were arrested,they went to the palace.,they had any wealth.,they wanted justice.,,D,Very Easy
Q522,VARC,READING COMPREHENSION,Passage-Based MCQ,Modern medicine is primarily concerned with,"In the world have we made health an end in itself? We have forgotten that health is really a means to enable a person to do his work and do it well. A lot of modern medicine is concerned with promotion of good health. Many patients as well as many physicians pay very little attention to health; but very much attention to health makes some people imagine that they are ill. Our great concern with health is shown by the medical columns in newspaper, the health articles in popular magazines and the popularity of the television programme and all those books on medicine. We talk about health all the time. Yet, for the most only result is more people are with imaginary illnesses. The healthy man should not be wasting any time talking about health, he should be using health for work, the work he does and the work that good health makes possible.",promotion of good health.,people suffering from imaginary illnesses.,people suffering from real illnesses.,increased efficiency in work,,A,Very Easy
Q523,VARC,READING COMPREHENSION,Passage-Based MCQ,A healthy man should be concerned with,"In the world have we made health an end in itself? We have forgotten that health is really a means to enable a person to do his work and do it well. A lot of modern medicine is concerned with promotion of good health. Many patients as well as many physicians pay very little attention to health; but very much attention to health makes some people imagine that they are ill. Our great concern with health is shown by the medical columns in newspaper, the health articles in popular magazines and the popularity of the television programme and all those books on medicine. We talk about health all the time. Yet, for the most only result is more people are with imaginary illnesses. The healthy man should not be wasting any time talking about health, he should be using health for work, the work he does and the work that good health makes possible.",his work which good health makes possible.,looking after his health.,his health which makes work possible.,talking about health.,,A,Very Easy
Q524,VARC,READING COMPREHENSION,Passage-Based MCQ,Talking about health all the time makes people,"In the world have we made health an end in itself? We have forgotten that health is really a means to enable a person to do his work and do it well. A lot of modern medicine is concerned with promotion of good health. Many patients as well as many physicians pay very little attention to health; but very much attention to health makes some people imagine that they are ill. Our great concern with health is shown by the medical columns in newspaper, the health articles in popular magazines and the popularity of the television programme and all those books on medicine. We talk about health all the time. Yet, for the most only result is more people are with imaginary illnesses. The healthy man should not be wasting any time talking about health, he should be using health for work, the work he does and the work that good health makes possible.",always suffer from imaginary illnesses.,sometimes suffer from imaginary illnesses.,rarely suffer from imaginary illnesses.,often suffer from imaginary illnesses.,,D,Very Easy
Q525,VARC,READING COMPREHENSION,Passage-Based MCQ,The passage suggests that,"In the world have we made health an end in itself? We have forgotten that health is really a means to enable a person to do his work and do it well. A lot of modern medicine is concerned with promotion of good health. Many patients as well as many physicians pay very little attention to health; but very much attention to health makes some people imagine that they are ill. Our great concern with health is shown by the medical columns in newspaper, the health articles in popular magazines and the popularity of the television programme and all those books on medicine. We talk about health all the time. Yet, for the most only result is more people are with imaginary illnesses. The healthy man should not be wasting any time talking about health, he should be using health for work, the work he does and the work that good health makes possible.",health is an end in itself.,health is a blessing.,health is only a means to an end.,we should not talk about health.,,C,Very Easy
Q526,VARC,READING COMPREHENSION,Passage-Based MCQ,The passage tells us,"In the world have we made health an end in itself? We have forgotten that health is really a means to enable a person to do his work and do it well. A lot of modern medicine is concerned with promotion of good health. Many patients as well as many physicians pay very little attention to health; but very much attention to health makes some people imagine that they are ill. Our great concern with health is shown by the medical columns in newspaper, the health articles in popular magazines and the popularity of the television programme and all those books on medicine. We talk about health all the time. Yet, for the most only result is more people are with imaginary illnesses. The healthy man should not be wasting any time talking about health, he should be using health for work, the work he does and the work that good health makes possible.",how medicines should be manufactured.,what a healthy man should or should not do.,what the television programmes should be about.,how best to imagine illnesses.,,B,Very Easy
Q527,VARC,READING COMPREHENSION,Passage-Based MCQ,The author portrays mankind as,"To avoid the various foolish opinions to which mankind are prone, no superhuman brain is required. A few simple rules will keep you free, not from all errors, but from silly errors. If the matter is one that can be settled by observation, make the observation yourself. Aristotle could have avoided the mistake of thinking that women have fewer teeth than men, by the simple device of asking Mrs. Aristotle to keep her mouth open while he counted. Thinking that you know when in fact you do not is a bad mistake, to which we are all prone. I believe myself that hedgehogs eat black beetles. because I have been told that they do: but if I were writing a book on the habits of hedgehogs, I should not commit myself until I had seen one enjoying this diet. Aristotle, however, was less cautious. Ancient and medieval writers knew all about unicorns and salamanders; not one of them thought it necessary to avoid dogmatic statements about them because he had never seen one of them.",superhuman,by and large ignorant,intelligent,ancient,,B,Easy
Q528,VARC,READING COMPREHENSION,Passage-Based MCQ,"According to the author, unicorns and salamanders","To avoid the various foolish opinions to which mankind are prone, no superhuman brain is required. A few simple rules will keep you free, not from all errors, but from silly errors. If the matter is one that can be settled by observation, make the observation yourself. Aristotle could have avoided the mistake of thinking that women have fewer teeth than men, by the simple device of asking Mrs. Aristotle to keep her mouth open while he counted. Thinking that you know when in fact you do not is a bad mistake, to which we are all prone. I believe myself that hedgehogs eat black beetles. because I have been told that they do: but if I were writing a book on the habits of hedgehogs, I should not commit myself until I had seen one enjoying this diet. Aristotle, however, was less cautious. Ancient and medieval writers knew all about unicorns and salamanders; not one of them thought it necessary to avoid dogmatic statements about them because he had never seen one of them.",have existed in the past,are invisible,caused writers to write strange stories.,never really existed,,D,Easy
Q529,VARC,READING COMPREHENSION,Passage-Based MCQ,The author implies that,"To avoid the various foolish opinions to which mankind are prone, no superhuman brain is required. A few simple rules will keep you free, not from all errors, but from silly errors. If the matter is one that can be settled by observation, make the observation yourself. Aristotle could have avoided the mistake of thinking that women have fewer teeth than men, by the simple device of asking Mrs. Aristotle to keep her mouth open while he counted. Thinking that you know when in fact you do not is a bad mistake, to which we are all prone. I believe myself that hedgehogs eat black beetles. because I have been told that they do: but if I were writing a book on the habits of hedgehogs, I should not commit myself until I had seen one enjoying this diet. Aristotle, however, was less cautious. Ancient and medieval writers knew all about unicorns and salamanders; not one of them thought it necessary to avoid dogmatic statements about them because he had never seen one of them.",he has never seen hedgehogs eating beetles,hedgehogs eat only black beetles,they do not eat black beetles,he is writing a book on hedgehogs.,,A,Easy
Q530,VARC,READING COMPREHENSION,Passage-Based MCQ,The author is in favour of drawing conclusions on the basis of,"To avoid the various foolish opinions to which mankind are prone, no superhuman brain is required. A few simple rules will keep you free, not from all errors, but from silly errors. If the matter is one that can be settled by observation, make the observation yourself. Aristotle could have avoided the mistake of thinking that women have fewer teeth than men, by the simple device of asking Mrs. Aristotle to keep her mouth open while he counted. Thinking that you know when in fact you do not is a bad mistake, to which we are all prone. I believe myself that hedgehogs eat black beetles. because I have been told that they do: but if I were writing a book on the habits of hedgehogs, I should not commit myself until I had seen one enjoying this diet. Aristotle, however, was less cautious. Ancient and medieval writers knew all about unicorns and salamanders; not one of them thought it necessary to avoid dogmatic statements about them because he had never seen one of them.",discussion,consultation,observation,reasoning,,C,Easy
Q531,VARC,READING COMPREHENSION,Passage-Based MCQ,The attitude of the author is,"To avoid the various foolish opinions to which mankind are prone, no superhuman brain is required. A few simple rules will keep you free, not from all errors, but from silly errors. If the matter is one that can be settled by observation, make the observation yourself. Aristotle could have avoided the mistake of thinking that women have fewer teeth than men, by the simple device of asking Mrs. Aristotle to keep her mouth open while he counted. Thinking that you know when in fact you do not is a bad mistake, to which we are all prone. I believe myself that hedgehogs eat black beetles. because I have been told that they do: but if I were writing a book on the habits of hedgehogs, I should not commit myself until I had seen one enjoying this diet. Aristotle, however, was less cautious. Ancient and medieval writers knew all about unicorns and salamanders; not one of them thought it necessary to avoid dogmatic statements about them because he had never seen one of them.",cultural,scientific,cynical,philosophical,,B,Easy
Q532,VARC,READING COMPREHENSION,Passage-Based MCQ,"What are the other activities of Peter Pan, the age- less boy who can fly?","Peter Pan is a character created by Scottish novelist and playwright JM Barrie. A mischievous boy who can fly and who never ages, Peter Pan spends his never-ending childhood adventuring on the small island of Neverland as the leader of his gang the Lost Boys, interacting with mermaids, Native Americans, fairies, pirates, and occasionally ordinary children from the world outside of Neverland. In addition to two distinct works by Barrie, the character has been featured in a variety of media and merchandise, both adapting and expanding on Barrie's works. Peter Pan first appeared in a section of The Little White Bird, a 1902 novel written by Barrie for adults. The character's best-known adventure debuted on 27 December 1904, in the stage play Peter Pan, or The Boy Who Wouldn't Grow Up. The play was adapted and expanded somewhat as a novel, published in 1911 as Peter and Wendy.",Interacting with ordinary children from outside Neverland,Interacting with fairies and mermaids,Interacting with J. M. Barrie,"Interacting with mermaids, native Americans, fairies, and ordinary children from outside Neverland",,D,Easy
Q533,VARC,READING COMPREHENSION,Passage-Based MCQ,Peter and Wendy was a _____.,"Peter Pan is a character created by Scottish novelist and playwright JM Barrie. A mischievous boy who can fly and who never ages, Peter Pan spends his never-ending childhood adventuring on the small island of Neverland as the leader of his gang the Lost Boys, interacting with mermaids, Native Americans, fairies, pirates, and occasionally ordinary children from the world outside of Neverland. In addition to two distinct works by Barrie, the character has been featured in a variety of media and merchandise, both adapting and expanding on Barrie's works. Peter Pan first appeared in a section of The Little White Bird, a 1902 novel written by Barrie for adults. The character's best-known adventure debuted on 27 December 1904, in the stage play Peter Pan, or The Boy Who Wouldn't Grow Up. The play was adapted and expanded somewhat as a novel, published in 1911 as Peter and Wendy.",play,novel,short-story,film,,B,Easy
Q534,VARC,READING COMPREHENSION,Passage-Based MCQ,"J. M. Barrie's creation, Peter Pan, featured-in addition to play in _____ .","Peter Pan is a character created by Scottish novelist and playwright JM Barrie. A mischievous boy who can fly and who never ages, Peter Pan spends his never-ending childhood adventuring on the small island of Neverland as the leader of his gang the Lost Boys, interacting with mermaids, Native Americans, fairies, pirates, and occasionally ordinary children from the world outside of Neverland. In addition to two distinct works by Barrie, the character has been featured in a variety of media and merchandise, both adapting and expanding on Barrie's works. Peter Pan first appeared in a section of The Little White Bird, a 1902 novel written by Barrie for adults. The character's best-known adventure debuted on 27 December 1904, in the stage play Peter Pan, or The Boy Who Wouldn't Grow Up. The play was adapted and expanded somewhat as a novel, published in 1911 as Peter and Wendy.",novels,"novels, media and merchandise",media and merchandise,None of the above,,B,Easy
